{
  "id": "null_equality",
  "description": "null == null \u2192 true; null == value \u2192 false; null != value \u2192 true (spec \u00a75.4).",
  "spec_refs": [
    "lace-spec.md \u00a75.4",
    "lace-spec.md \u00a715.4"
  ],
  "type": "execute",
  "input": {
    "source": "get(\"http://127.0.0.1:{port}/x\").expect(status: 200).assert({ expect: [$absent eq null, $absent neq 5] })\n",
    "variables": {},
    "http_mock": [
      {
        "callIndex": 0,
        "outcome": "response",
        "status": 200,
        "headers": {},
        "body": ""
      }
    ]
  },
  "expected": {
    "result": {
      "outcome": "success",
      "startedAt": "1970-01-01T00:00:00Z",
      "endedAt": "1970-01-01T00:00:00Z",
      "runVars": {},
      "calls": [
        {
          "index": 0,
          "outcome": "success",
          "startedAt": "1970-01-01T00:00:00Z",
          "endedAt": "1970-01-01T00:00:00Z",
          "request": {
            "url": "http://127.0.0.1:{port}/x",
            "method": "get",
            "headers": {},
            "bodyPath": null
          },
          "response": {
            "status": 200,
            "statusText": "OK",
            "headers": {},
            "bodyPath": null,
            "bodyNotCapturedReason": "notRequested",
            "responseTimeMs": 0,
            "dnsMs": 0,
            "connectMs": 0,
            "tlsMs": 0,
            "ttfbMs": 0,
            "transferMs": 0,
            "sizeBytes": 0
          },
          "redirects": [],
          "assertions": [
            {
              "method": "expect",
              "scope": "status",
              "op": "eq",
              "outcome": "passed",
              "actual": 200,
              "expected": 200,
              "options": null
            },
            {
              "method": "assert",
              "kind": "expect",
              "index": 0,
              "outcome": "passed",
              "expression": "$absent eq null",
              "actualLhs": null,
              "actualRhs": null,
              "options": null
            },
            {
              "method": "assert",
              "kind": "expect",
              "index": 1,
              "outcome": "passed",
              "expression": "$absent neq 5",
              "actualLhs": null,
              "actualRhs": 5,
              "options": null
            }
          ],
          "config": {},
          "warnings": [],
          "error": null
        }
      ],
      "actions": {}
    },
    "ignore": [
      "startedAt",
      "endedAt",
      "calls[*].startedAt",
      "calls[*].endedAt",
      "calls[*].request.bodyPath",
      "calls[*].response.responseTimeMs",
      "calls[*].response.dnsMs",
      "calls[*].response.connectMs",
      "calls[*].response.ttfbMs",
      "calls[*].response.transferMs",
      "calls[*].config"
    ]
  }
}