{
  "id": "named_selective_clear",
  "description": "`cookieJar: \"api:selective_clear\"` with `clearCookies: [\"tok\"]` targets the named `api` jar and clears only the `tok` key from that jar, leaving the default jar untouched (spec \u00a715.6). Call 0 primes the `api` jar with tok=xyz. Call 1 uses `api:selective_clear` with `clearCookies: [\"tok\"]` \u2014 the outgoing Cookie header is empty (no cookies remain in the `api` jar).",
  "spec_refs": [
    "lace-spec.md \u00a73.3",
    "lace-spec.md \u00a715.6"
  ],
  "type": "execute",
  "input": {
    "source": "post(\"http://127.0.0.1:{port}/login\", { cookieJar: \"named:api\" }).expect(status: 200)\nget(\"http://127.0.0.1:{port}/after\", { cookieJar: \"api:selective_clear\", clearCookies: [\"tok\"] }).expect(status: 200)\n",
    "variables": {},
    "http_mock": [
      {
        "callIndex": 0,
        "outcome": "response",
        "status": 200,
        "headers": {
          "set-cookie": "tok=xyz; Path=/"
        },
        "body": ""
      },
      {
        "callIndex": 1,
        "outcome": "response",
        "status": 200,
        "headers": {},
        "body": ""
      }
    ]
  },
  "expected": {
    "result": {
      "outcome": "success",
      "startedAt": "1970-01-01T00:00:00Z",
      "endedAt": "1970-01-01T00:00:00Z",
      "runVars": {},
      "calls": [
        {
          "index": 0,
          "outcome": "success",
          "startedAt": "1970-01-01T00:00:00Z",
          "endedAt": "1970-01-01T00:00:00Z",
          "request": "IGNORED",
          "response": "IGNORED",
          "redirects": [],
          "assertions": [
            {
              "method": "expect",
              "scope": "status",
              "op": "eq",
              "outcome": "passed",
              "actual": 200,
              "expected": 200,
              "options": null
            }
          ],
          "config": {},
          "warnings": [],
          "error": null
        },
        {
          "index": 1,
          "outcome": "success",
          "startedAt": "1970-01-01T00:00:00Z",
          "endedAt": "1970-01-01T00:00:00Z",
          "request": {
            "url": "http://127.0.0.1:{port}/after",
            "method": "get",
            "headers": {},
            "bodyPath": null
          },
          "response": "IGNORED",
          "redirects": [],
          "assertions": [
            {
              "method": "expect",
              "scope": "status",
              "op": "eq",
              "outcome": "passed",
              "actual": 200,
              "expected": 200,
              "options": null
            }
          ],
          "config": {},
          "warnings": [],
          "error": null
        }
      ],
      "actions": {}
    },
    "ignore": [
      "startedAt",
      "endedAt",
      "calls[*].startedAt",
      "calls[*].endedAt",
      "calls[0].request",
      "calls[0].response",
      "calls[1].response",
      "calls[1].request.bodyPath",
      "calls[*].config"
    ]
  }
}
