{
  "id": "spike_detected_low_baseline",
  "description": "When baseline averages are extremely low, a normal response triggers spike detection on responseTimeMs. At minimum one spike event and one notification are emitted.",
  "spec_refs": ["lace-extensions.md §13"],
  "type": "extension",
  "requires": ["extensions", "actions"],
  "input": {
    "source": "get(\"http://127.0.0.1:{port}/x\").expect(status: 200)\n",
    "variables": {},
    "extensions": ["laceNotifications", "laceBaseline"],
    "lace_config": "[extensions.laceBaseline]\nspike_multiplier = 1.0\n",
    "prev_results": {
      "outcome": "success",
      "startedAt": "1970-01-01T00:00:00Z",
      "endedAt": "1970-01-01T00:00:00Z",
      "runVars": {
        "laceBaseline.stats": {
          "count": 10,
          "sums": {
            "responseTimeMs": 0.01,
            "dnsMs": 0.0,
            "connectMs": 0.01,
            "tlsMs": 0.0,
            "ttfbMs": 0.01,
            "transferMs": 0.01,
            "sizeBytes": 0.0
          }
        }
      },
      "calls": [],
      "actions": {}
    },
    "http_mock": [
      {
        "callIndex": 0,
        "outcome": "response",
        "status": 200,
        "headers": {},
        "body": ""
      }
    ]
  },
  "expected": {
    "result": {
      "outcome": "success",
      "startedAt": "1970-01-01T00:00:00Z",
      "endedAt": "1970-01-01T00:00:00Z",
      "runVars": "IGNORED",
      "calls": "IGNORED",
      "actions": {
        "notifications": "NON_NULL"
      }
    },
    "ignore": [
      "startedAt",
      "endedAt",
      "calls"
    ]
  }
}
