{
  "id": "schema_runtime_success",
  "description": "body: schema($schemaVar) passes when $schemaVar is a valid JSON Schema and the response body is valid JSON that matches it (spec \u00a715.8). The scope passes; the call succeeds.",
  "spec_refs": [
    "lace-spec.md \u00a715.8",
    "lace-spec.md \u00a74.5"
  ],
  "type": "execute",
  "input": {
    "source": "get(\"http://127.0.0.1:{port}/x\").expect(status: 200, body: schema($schemaVar))\n",
    "variables": {
      "schemaVar": {
        "type": "object",
        "properties": {
          "id": { "type": "integer" },
          "name": { "type": "string" }
        },
        "required": ["id", "name"]
      }
    },
    "http_mock": [
      {
        "callIndex": 0,
        "outcome": "response",
        "status": 200,
        "headers": {
          "content-type": "application/json"
        },
        "body": "{\"id\": 1, \"name\": \"alice\"}"
      }
    ]
  },
  "expected": {
    "result": {
      "outcome": "success",
      "startedAt": "1970-01-01T00:00:00Z",
      "endedAt": "1970-01-01T00:00:00Z",
      "runVars": {},
      "calls": [
        {
          "index": 0,
          "outcome": "success",
          "startedAt": "1970-01-01T00:00:00Z",
          "endedAt": "1970-01-01T00:00:00Z",
          "request": "IGNORED",
          "response": "IGNORED",
          "redirects": [],
          "assertions": [
            {
              "method": "expect",
              "scope": "status",
              "op": "eq",
              "outcome": "passed",
              "actual": 200,
              "expected": 200,
              "options": null
            },
            {
              "method": "expect",
              "scope": "body",
              "op": "eq",
              "outcome": "passed",
              "actual": "IGNORED",
              "expected": "IGNORED",
              "options": null
            }
          ],
          "config": {},
          "warnings": [],
          "error": null
        }
      ],
      "actions": {}
    },
    "ignore": [
      "startedAt",
      "endedAt",
      "calls[*].startedAt",
      "calls[*].endedAt",
      "calls[*].request",
      "calls[*].response",
      "calls[*].config",
      "calls[*].assertions[*].actual",
      "calls[*].assertions[*].expected"
    ]
  }
}
