{
  "id": "null_equals_null_true",
  "description": "null == null is true (spec \u00a715.4). Both $a and $b are absent from the variable map and therefore resolve to null; the equality assertion passes.",
  "spec_refs": [
    "lace-spec.md \u00a715.4",
    "lace-spec.md \u00a75.4"
  ],
  "type": "execute",
  "input": {
    "source": "get(\"http://127.0.0.1:{port}/x\").expect(status: 200).assert({ expect: [$a eq $b] })\n",
    "variables": {},
    "http_mock": [
      {
        "callIndex": 0,
        "outcome": "response",
        "status": 200,
        "headers": {},
        "body": ""
      }
    ]
  },
  "expected": {
    "result": {
      "outcome": "success",
      "startedAt": "1970-01-01T00:00:00Z",
      "endedAt": "1970-01-01T00:00:00Z",
      "runVars": {},
      "calls": [
        {
          "index": 0,
          "outcome": "success",
          "startedAt": "1970-01-01T00:00:00Z",
          "endedAt": "1970-01-01T00:00:00Z",
          "request": "IGNORED",
          "response": "IGNORED",
          "redirects": [],
          "assertions": [
            {
              "method": "expect",
              "scope": "status",
              "op": "eq",
              "outcome": "passed",
              "actual": 200,
              "expected": 200,
              "options": null
            },
            {
              "method": "assert",
              "kind": "expect",
              "index": 0,
              "outcome": "passed",
              "expression": "$a eq $b",
              "actualLhs": null,
              "actualRhs": null,
              "options": null
            }
          ],
          "config": {},
          "warnings": [],
          "error": null
        }
      ],
      "actions": {}
    },
    "ignore": [
      "startedAt",
      "endedAt",
      "calls[*].startedAt",
      "calls[*].endedAt",
      "calls[*].request",
      "calls[*].response",
      "calls[*].config"
    ]
  }
}