{
  "id": "patch_method_executes",
  "description": "A PATCH call with a minimal request body/empty body produces an outcome:success with the expected status.",
  "spec_refs": [
    "lace-spec.md \u00a73.1"
  ],
  "type": "execute",
  "input": {
    "source": "patch(\"http://127.0.0.1:{port}/x\").expect(status: 200)\n",
    "variables": {},
    "http_mock": [
      {
        "callIndex": 0,
        "outcome": "response",
        "status": 200,
        "headers": {},
        "body": ""
      }
    ]
  },
  "expected": {
    "result": {
      "outcome": "success",
      "startedAt": "1970-01-01T00:00:00Z",
      "endedAt": "1970-01-01T00:00:00Z",
      "runVars": {},
      "calls": [
        {
          "index": 0,
          "outcome": "success",
          "startedAt": "1970-01-01T00:00:00Z",
          "endedAt": "1970-01-01T00:00:00Z",
          "request": "IGNORED",
          "response": "IGNORED",
          "redirects": [],
          "assertions": [
            {
              "method": "expect",
              "scope": "status",
              "op": "eq",
              "outcome": "passed",
              "actual": 200,
              "expected": 200,
              "options": null
            }
          ],
          "config": {},
          "warnings": [],
          "error": null
        }
      ],
      "actions": {}
    },
    "ignore": [
      "startedAt",
      "endedAt",
      "calls[*].startedAt",
      "calls[*].endedAt",

      "calls[*].response.bodyPath",
      "calls[*].response.responseTimeMs",
      "calls[*].response.dnsMs",
      "calls[*].response.connectMs",
      "calls[*].response.tlsMs",
      "calls[*].response.ttfbMs",
      "calls[*].response.transferMs",
      "calls[*].config",
      "calls[*].request",
      "calls[*].response"
    ]
  }
}
