{
  "id": "timeout_warn_action_continues",
  "description": "timeout.action: \"warn\" records a soft fail and continues execution to the next call (spec \u00a73.2, \u00a77).",
  "spec_refs": [
    "lace-spec.md \u00a73.2",
    "lace-spec.md \u00a715.5"
  ],
  "type": "execute",
  "input": {
    "source": "get(\"http://127.0.0.1:{port}/slow\", { timeout: { ms: 100, action: \"warn\" } }).expect(status: 200)\nget(\"http://127.0.0.1:{port}/fast\").expect(status: 200)\n",
    "variables": {},
    "http_mock": [
      {
        "callIndex": 0,
        "outcome": "timeout"
      },
      {
        "callIndex": 1,
        "outcome": "response",
        "status": 200,
        "headers": {},
        "body": ""
      }
    ]
  },
  "expected": {
    "result": {
      "outcome": "success",
      "startedAt": "1970-01-01T00:00:00Z",
      "endedAt": "1970-01-01T00:00:00Z",
      "runVars": {},
      "calls": [
        {
          "index": 0,
          "outcome": "timeout",
          "startedAt": "1970-01-01T00:00:00Z",
          "endedAt": "1970-01-01T00:00:00Z",
          "request": {
            "url": "http://127.0.0.1:{port}/slow",
            "method": "get",
            "headers": {},
            "bodyPath": null
          },
          "response": null,
          "redirects": [],
          "assertions": [],
          "config": {},
          "warnings": [],
          "error": null
        },
        {
          "index": 1,
          "outcome": "success",
          "startedAt": "1970-01-01T00:00:00Z",
          "endedAt": "1970-01-01T00:00:00Z",
          "request": {
            "url": "http://127.0.0.1:{port}/fast",
            "method": "get",
            "headers": {},
            "bodyPath": null
          },
          "response": {
            "status": 200,
            "statusText": "OK",
            "headers": {},
            "bodyPath": null,
            "bodyNotCapturedReason": "notRequested",
            "responseTimeMs": 0,
            "dnsMs": 0,
            "connectMs": 0,
            "tlsMs": 0,
            "ttfbMs": 0,
            "transferMs": 0,
            "sizeBytes": 0
          },
          "redirects": [],
          "assertions": [
            {
              "method": "expect",
              "scope": "status",
              "op": "eq",
              "outcome": "passed",
              "actual": 200,
              "expected": 200,
              "options": null
            }
          ],
          "config": {},
          "warnings": [],
          "error": null
        }
      ],
      "actions": {}
    },
    "ignore": [
      "startedAt",
      "endedAt",
      "calls[*].startedAt",
      "calls[*].endedAt",
      "calls[*].request.bodyPath",
      "calls[*].response.bodyPath",
      "calls[*].response.responseTimeMs",
      "calls[*].response.dnsMs",
      "calls[*].response.connectMs",
      "calls[*].response.ttfbMs",
      "calls[*].response.transferMs",
      "calls[*].config"
    ]
  }
}
