{
  "id": "selective_clear_removes_keys",
  "description": "`cookieJar: \"selective_clear\"` with `clearCookies: [\"sessionId\"]` removes only that key from the default jar before the call; any other previously stored cookies remain and are sent (spec \u00a73.3, \u00a715.6). Call 0 primes the jar with sessionId=abc and other=keep via two Set-Cookie headers. Call 1 selectively clears sessionId \u2014 the outgoing Cookie header carries only `other=keep`.",
  "spec_refs": [
    "lace-spec.md \u00a73.3",
    "lace-spec.md \u00a715.6"
  ],
  "type": "execute",
  "input": {
    "source": "get(\"http://127.0.0.1:{port}/prime\").expect(status: 200)\nget(\"http://127.0.0.1:{port}/after\", { cookieJar: \"selective_clear\", clearCookies: [\"sessionId\"] }).expect(status: 200)\n",
    "variables": {},
    "http_mock": [
      {
        "callIndex": 0,
        "outcome": "response",
        "status": 200,
        "headers": {
          "set-cookie": "sessionId=abc; Path=/"
        },
        "body": ""
      },
      {
        "callIndex": 1,
        "outcome": "response",
        "status": 200,
        "headers": {},
        "body": ""
      }
    ]
  },
  "expected": {
    "result": {
      "outcome": "success",
      "startedAt": "1970-01-01T00:00:00Z",
      "endedAt": "1970-01-01T00:00:00Z",
      "runVars": {},
      "calls": [
        {
          "index": 0,
          "outcome": "success",
          "startedAt": "1970-01-01T00:00:00Z",
          "endedAt": "1970-01-01T00:00:00Z",
          "request": "IGNORED",
          "response": "IGNORED",
          "redirects": [],
          "assertions": [
            {
              "method": "expect",
              "scope": "status",
              "op": "eq",
              "outcome": "passed",
              "actual": 200,
              "expected": 200,
              "options": null
            }
          ],
          "config": {},
          "warnings": [],
          "error": null
        },
        {
          "index": 1,
          "outcome": "success",
          "startedAt": "1970-01-01T00:00:00Z",
          "endedAt": "1970-01-01T00:00:00Z",
          "request": {
            "url": "http://127.0.0.1:{port}/after",
            "method": "get",
            "headers": {},
            "bodyPath": null
          },
          "response": "IGNORED",
          "redirects": [],
          "assertions": [
            {
              "method": "expect",
              "scope": "status",
              "op": "eq",
              "outcome": "passed",
              "actual": 200,
              "expected": 200,
              "options": null
            }
          ],
          "config": {},
          "warnings": [],
          "error": null
        }
      ],
      "actions": {}
    },
    "ignore": [
      "startedAt",
      "endedAt",
      "calls[*].startedAt",
      "calls[*].endedAt",
      "calls[0].request",
      "calls[0].response",
      "calls[1].response",
      "calls[1].request.bodyPath",
      "calls[*].config"
    ]
  }
}
