{
  "id": "assert_count_non_array",
  "description": "count() returns 1 for a non-array value (here a JSON object body) inside an .assert() condition (spec §8.1).",
  "spec_refs": [
    "lace-spec.md §8.1",
    "lace-spec.md §4.7"
  ],
  "type": "execute",
  "input": {
    "source": "get(\"http://127.0.0.1:{port}/x\").expect(status: 200).assert({ expect: [count(this.body) eq 1] })\n",
    "variables": {},
    "http_mock": [
      {
        "callIndex": 0,
        "outcome": "response",
        "status": 200,
        "headers": { "content-type": "application/json" },
        "body": "{\"x\":1}"
      }
    ]
  },
  "expected": {
    "result": {
      "outcome": "success",
      "startedAt": "1970-01-01T00:00:00Z",
      "endedAt": "1970-01-01T00:00:00Z",
      "runVars": {},
      "calls": [
        {
          "index": 0,
          "outcome": "success",
          "startedAt": "1970-01-01T00:00:00Z",
          "endedAt": "1970-01-01T00:00:00Z",
          "request": "IGNORED",
          "response": "IGNORED",
          "redirects": [],
          "assertions": [
            {
              "method": "expect",
              "scope": "status",
              "op": "eq",
              "outcome": "passed",
              "actual": 200,
              "expected": 200,
              "options": null
            },
            {
              "method": "assert",
              "kind": "expect",
              "index": 0,
              "outcome": "passed",
              "expression": "count(this.body) eq 1",
              "actualLhs": 1,
              "actualRhs": 1,
              "options": null
            }
          ],
          "config": {},
          "warnings": [],
          "error": null
        }
      ],
      "actions": {}
    },
    "ignore": [
      "startedAt",
      "endedAt",
      "calls[*].startedAt",
      "calls[*].endedAt",
      "calls[*].request",
      "calls[*].response",
      "calls[*].config"
    ]
  }
}
